{
  "calendar": {
    "streak": 1,
    "submission_calendar": "{\"1778198400\": 1, \"1789689600\": 1}",
    "total_active_days": 2
  },
  "display_name": "730",
  "last_updated": "2026-10-19T14:38:00.428796+00:00",
  "leetcode_username": "730",
  "plan": {
    "end_date": null,
    "start_date": "2025-01-22",
    "submissions_in_period": 0
  },
  "profile": {
    "country_name": null,
    "ranking": 3422202,
    "real_name": "duwz730",
    "reputation": 0,
    "user_avatar": "https://assets.leetcode.com/users/avatars/avatar_1700455124.png"
  },
  "recent_submissions": [
    {
      "id": "2146139988",
      "proof_url": "https://leetcode.com/submissions/detail/2146139988/",
      "submitted_at": "2026-09-18T21:05:51+00:00",
      "timestamp": "1789765551",
      "title": "Merge Strings Alternately",
      "title_slug": "merge-strings-alternately"
    }
  ],
  "server_region": "US",
  "totals": {
    "all": 35,
    "easy": 23,
    "hard": 0,
    "medium": 12
  }
}
