{
  "calendar": {
    "streak": 0,
    "submission_calendar": "{}",
    "total_active_days": 0
  },
  "display_name": "Fulwin",
  "last_updated": "2026-10-27T13:09:57.518951+00:00",
  "leetcode_username": "danielyanzhengyuhan",
  "plan": {
    "end_date": "2025-05-01",
    "start_date": "2025-01-31",
    "submissions_in_period": 0
  },
  "profile": {
    "country_name": null,
    "ranking": 1777593,
    "real_name": "danielyanzhengyuhan",
    "reputation": 0,
    "user_avatar": "https://assets.leetcode.com/users/avatars/avatar_1663478425.png"
  },
  "recent_submissions": [],
  "server_region": "US",
  "totals": {
    "all": 95,
    "easy": 41,
    "hard": 4,
    "medium": 50
  }
}
