{
  "calendar": {
    "streak": 4,
    "submission_calendar": "{\"1771459200\": 7, \"1771545600\": 3, \"1771977600\": 4, \"1773619200\": 6, \"1773705600\": 5, \"1773964800\": 1, \"1774137600\": 5, \"1774224000\": 7, \"1774310400\": 3, \"1774396800\": 4, \"1774742400\": 2, \"1775001600\": 3, \"1775174400\": 3, \"1781136000\": 5, \"1781481600\": 9, \"1781568000\": 7, \"1781654400\": 4, \"1782691200\": 1, \"1782864000\": 1, \"1784160000\": 7, \"1784246400\": 8, \"1785715200\": 1, \"1787875200\": 1, \"1788307200\": 2, \"1788393600\": 7, \"1788825600\": 2, \"1789430400\": 6, \"1789603200\": 3, \"1789689600\": 1, \"1789948800\": 8, \"1790121600\": 7, \"1790640000\": 4, \"1790726400\": 2, \"1761523200\": 1, \"1761609600\": 5, \"1761696000\": 9, \"1762214400\": 4, \"1762300800\": 6, \"1762905600\": 6}",
    "total_active_days": 39
  },
  "display_name": "retep",
  "last_updated": "2026-10-15T12:37:29.735914+00:00",
  "leetcode_username": "retep_we",
  "plan": {
    "end_date": "2025-01-31",
    "start_date": "2025-01-24",
    "submissions_in_period": 0
  },
  "profile": {
    "country_name": null,
    "ranking": 1784760,
    "real_name": "retep_we",
    "reputation": 0,
    "user_avatar": "https://assets.leetcode.com/users/retep_we/avatar_1730515392.png"
  },
  "recent_submissions": [
    {
      "id": "2157708751",
      "proof_url": "https://leetcode.com/submissions/detail/2157708751/",
      "submitted_at": "2026-09-30T03:19:41+00:00",
      "timestamp": "1790738381",
      "title": "LFU Cache",
      "title_slug": "lfu-cache"
    },
    {
      "id": "2157659258",
      "proof_url": "https://leetcode.com/submissions/detail/2157659258/",
      "submitted_at": "2026-09-30T01:22:31+00:00",
      "timestamp": "1790731351",
      "title": "Find Median from Data Stream",
      "title_slug": "find-median-from-data-stream"
    },
    {
      "id": "2157622243",
      "proof_url": "https://leetcode.com/submissions/detail/2157622243/",
      "submitted_at": "2026-09-29T23:15:55+00:00",
      "timestamp": "1790723755",
      "title": "Word Search II",
      "title_slug": "word-search-ii"
    },
    {
      "id": "2157612896",
      "proof_url": "https://leetcode.com/submissions/detail/2157612896/",
      "submitted_at": "2026-09-29T22:41:35+00:00",
      "timestamp": "1790721695",
      "title": "Minimum Cost to Hire K Workers",
      "title_slug": "minimum-cost-to-hire-k-workers"
    },
    {
      "id": "2150369605",
      "proof_url": "https://leetcode.com/submissions/detail/2150369605/",
      "submitted_at": "2026-09-23T03:29:38+00:00",
      "timestamp": "1790134178",
      "title": "Minimum Remove to Make Valid Parentheses",
      "title_slug": "minimum-remove-to-make-valid-parentheses"
    },
    {
      "id": "2150343124",
      "proof_url": "https://leetcode.com/submissions/detail/2150343124/",
      "submitted_at": "2026-09-23T02:44:55+00:00",
      "timestamp": "1790131495",
      "title": "Find All Anagrams in a String",
      "title_slug": "find-all-anagrams-in-a-string"
    },
    {
      "id": "2150328232",
      "proof_url": "https://leetcode.com/submissions/detail/2150328232/",
      "submitted_at": "2026-09-23T02:15:10+00:00",
      "timestamp": "1790129710",
      "title": "Group Anagrams",
      "title_slug": "group-anagrams"
    },
    {
      "id": "2150317242",
      "proof_url": "https://leetcode.com/submissions/detail/2150317242/",
      "submitted_at": "2026-09-23T01:50:34+00:00",
      "timestamp": "1790128234",
      "title": "Jump Game",
      "title_slug": "jump-game"
    },
    {
      "id": "2150308859",
      "proof_url": "https://leetcode.com/submissions/detail/2150308859/",
      "submitted_at": "2026-09-23T01:30:32+00:00",
      "timestamp": "1790127032",
      "title": "Delete Node in a Linked List",
      "title_slug": "delete-node-in-a-linked-list"
    },
    {
      "id": "2148821542",
      "proof_url": "https://leetcode.com/submissions/detail/2148821542/",
      "submitted_at": "2026-09-21T15:57:54+00:00",
      "timestamp": "1790006274",
      "title": "Time Based Key-Value Store",
      "title_slug": "time-based-key-value-store"
    },
    {
      "id": "2148196749",
      "proof_url": "https://leetcode.com/submissions/detail/2148196749/",
      "submitted_at": "2026-09-21T02:57:16+00:00",
      "timestamp": "1789959436",
      "title": "Insert Delete GetRandom O(1)",
      "title_slug": "insert-delete-getrandom-o1"
    },
    {
      "id": "2148166556",
      "proof_url": "https://leetcode.com/submissions/detail/2148166556/",
      "submitted_at": "2026-09-21T01:29:15+00:00",
      "timestamp": "1789954155",
      "title": "LRU Cache",
      "title_slug": "lru-cache"
    },
    {
      "id": "2145859401",
      "proof_url": "https://leetcode.com/submissions/detail/2145859401/",
      "submitted_at": "2026-09-18T15:15:23+00:00",
      "timestamp": "1789744523",
      "title": "First Unique Number",
      "title_slug": "first-unique-number"
    },
    {
      "id": "2145220101",
      "proof_url": "https://leetcode.com/submissions/detail/2145220101/",
      "submitted_at": "2026-09-17T23:54:06+00:00",
      "timestamp": "1789689246",
      "title": "Design Event Manager",
      "title_slug": "design-event-manager"
    },
    {
      "id": "2145212082",
      "proof_url": "https://leetcode.com/submissions/detail/2145212082/",
      "submitted_at": "2026-09-17T23:21:48+00:00",
      "timestamp": "1789687308",
      "title": "Operations on Tree",
      "title_slug": "operations-on-tree"
    },
    {
      "id": "2143096140",
      "proof_url": "https://leetcode.com/submissions/detail/2143096140/",
      "submitted_at": "2026-09-15T22:21:11+00:00",
      "timestamp": "1789510871",
      "title": "Design Hit Counter",
      "title_slug": "design-hit-counter"
    },
    {
      "id": "2142113348",
      "proof_url": "https://leetcode.com/submissions/detail/2142113348/",
      "submitted_at": "2026-09-15T02:45:28+00:00",
      "timestamp": "1789440328",
      "title": "Design Snake Game",
      "title_slug": "design-snake-game"
    },
    {
      "id": "2142060442",
      "proof_url": "https://leetcode.com/submissions/detail/2142060442/",
      "submitted_at": "2026-09-15T00:10:41+00:00",
      "timestamp": "1789431041",
      "title": "Binary Search Tree Iterator",
      "title_slug": "binary-search-tree-iterator"
    },
    {
      "id": "2134592835",
      "proof_url": "https://leetcode.com/submissions/detail/2134592835/",
      "submitted_at": "2026-09-08T04:07:59+00:00",
      "timestamp": "1788840479",
      "title": "Find the Duplicate Number",
      "title_slug": "find-the-duplicate-number"
    },
    {
      "id": "2134577880",
      "proof_url": "https://leetcode.com/submissions/detail/2134577880/",
      "submitted_at": "2026-09-08T03:50:01+00:00",
      "timestamp": "1788839401",
      "title": "Binary Tree Level Order Traversal II",
      "title_slug": "binary-tree-level-order-traversal-ii"
    }
  ],
  "server_region": "US",
  "totals": {
    "all": 94,
    "easy": 5,
    "hard": 10,
    "medium": 79
  }
}
