{
  "calendar": {
    "streak": 0,
    "submission_calendar": "{}",
    "total_active_days": 0
  },
  "display_name": "Kalina",
  "last_updated": "2026-10-25T12:32:30.965119+00:00",
  "leetcode_username": "Cobalt_3902",
  "plan": {
    "end_date": null,
    "start_date": "2024-10-28",
    "submissions_in_period": 0
  },
  "profile": {
    "country_name": "United States",
    "ranking": 598314,
    "real_name": "Kalina",
    "reputation": 0,
    "user_avatar": "https://assets.leetcode.com/users/Cobalt_3902/avatar_1739162987.png"
  },
  "recent_submissions": [],
  "server_region": "US",
  "totals": {
    "all": 270,
    "easy": 93,
    "hard": 24,
    "medium": 153
  }
}
