{
  "calendar": {
    "streak": 0,
    "submission_calendar": "{}",
    "total_active_days": 0
  },
  "display_name": "codezera",
  "last_updated": "2026-10-13T14:59:35.923095+00:00",
  "leetcode_username": "EnAmiaN_AKIOI",
  "plan": {
    "end_date": "2075-01-01",
    "start_date": "2025-01-21",
    "submissions_in_period": 0
  },
  "profile": {
    "country_name": null,
    "ranking": 4245702,
    "real_name": "Yuanji Wang",
    "reputation": 0,
    "user_avatar": "https://assets.leetcode.com/users/EnAmiaN_AKIOI/avatar_1719031418.png"
  },
  "recent_submissions": [],
  "server_region": "US",
  "totals": {
    "all": 23,
    "easy": 10,
    "hard": 2,
    "medium": 11
  }
}
